### ISSUE TITLE
doesn't seem to support ipv6 address lookup

### ISSUE THREAD

**Issue by brianjmurrell** [xbmc/Kore#674]
### Describe the bug
Here is a clear and concise description of what the problem is:
When trying to connect to a Kodi instance, Kore seems to only to DNS A RR lookup and not also doing AAAA lookups for an IPv6 address.

## Expected Behavior
Here is a clear and concise description of what was expected to happen:
When trying to connect to a Kodi instance by name AAAA record lookups should happen in addition to (and per IPv6, prior to) IPv4 lookups.

## Actual Behavior
Only IPv4 A lookups are done.

### To Reproduce
1. Configure a Kodi instance with an IPv6 address
2. Configure a DNS record for the Kodi instance so that only the IPv6 AAAA record exists
3. Try to configure that name from step #2 in Kore and hit TEST
4. Observe with a sniffer that Kore only does A record queries

### Debuglog
The debuglog can be found here:
Tell me how to get one and I will supply it if still necessary.

### Screenshots 
Here are some links or screenshots to help explain the problem:
N/A

## Additional context or screenshots (if appropriate)
Here is some additional context or explanation that might help:
TCP/IP traffic of DNS lookups:
```tcpdump
13:50:53.502749 IP6 fd31:aeb1:48df:0:6958:47b:da9d:b1d.29812 > fd31:aeb1:48df::2.53: 25443+ A? kodi-machine.example.com. (43)
13:50:53.503369 IP6 fd31:aeb1:48df::2.53 > fd31:aeb1:48df:0:6958:47b:da9d:b1d.29812: 25443 NXDomain* 0/1/0 (97)
13:50:53.506521 IP 10.75.22.32.24649 > 10.75.22.247.53: 25443+ A? kodi-machine.example.com. (43)
13:50:53.507107 IP 10.75.22.247.53 > 10.75.22.32.24649: 25443 NXDomain* 0/1/0 (97)
13:50:53.510146 IP6 fd31:aeb1:48df:0:6958:47b:da9d:b1d.17363 > fd31:aeb1:48df::2.53: 25443+ A? kodi-machine.example.com. (43)
13:50:53.510790 IP6 fd31:aeb1:48df::2.53 > fd31:aeb1:48df:0:6958:47b:da9d:b1d.17363: 25443 NXDomain* 0/1/0 (97)
13:50:53.512783 IP 10.75.22.32.3682 > 10.75.22.247.53: 25443+ A? kodi-machine.example.com. (43)
13:50:53.513381 IP 10.75.22.247.53 > 10.75.22.32.3682: 25443 NXDomain* 0/1/0 (97)
13:50:53.517918 IP6 fd31:aeb1:48df:0:6958:47b:da9d:b1d.32606 > fd31:aeb1:48df::2.53: 12080+ A? kodi-machine.localdom. (33)
13:50:53.563439 IP6 fd31:aeb1:48df::2.53 > fd31:aeb1:48df:0:6958:47b:da9d:b1d.32606: 12080 NXDomain 0/1/0 (108)
13:50:53.565220 IP 10.75.22.32.8834 > 10.75.22.247.53: 12080+ A? kodi-machine.localdom. (33)
13:50:53.566315 IP 10.75.22.247.53 > 10.75.22.32.8834: 12080 NXDomain 0/1/0 (108)
13:50:53.568803 IP6 fd31:aeb1:48df:0:6958:47b:da9d:b1d.16755 > fd31:aeb1:48df::2.53: 12080+ A? kodi-machine.localdom. (33)
13:50:53.569593 IP6 fd31:aeb1:48df::2.53 > fd31:aeb1:48df:0:6958:47b:da9d:b1d.16755: 12080 NXDomain 0/1/0 (108)
13:50:53.572254 IP 10.75.22.32.33030 > 10.75.22.247.53: 12080+ A? kodi-machine.localdom. (33)
13:50:53.572851 IP 10.75.22.247.53 > 10.75.22.32.33030: 12080 NXDomain 0/1/0 (108)
13:50:53.578101 IP6 fd31:aeb1:48df:0:6958:47b:da9d:b1d.25959 > fd31:aeb1:48df::2.53: 4827+ A? kodi-machine. (27)
13:50:53.666944 IP6 fd31:aeb1:48df::2.53 > fd31:aeb1:48df:0:6958:47b:da9d:b1d.25959: 4827 NXDomain 0/1/0 (102)
13:50:53.673869 IP 10.75.22.32.1235 > 10.75.22.247.53: 4827+ A? kodi-machine. (27)
13:50:53.674492 IP 10.75.22.247.53 > 10.75.22.32.1235: 4827 NXDomain 0/1/0 (102)
13:50:53.676563 IP6 fd31:aeb1:48df:0:6958:47b:da9d:b1d.30928 > fd31:aeb1:48df::2.53: 4827+ A? kodi-machine. (27)
13:50:53.677167 IP6 fd31:aeb1:48df::2.53 > fd31:aeb1:48df:0:6958:47b:da9d:b1d.30928: 4827 NXDomain 0/1/0 (102)
13:50:53.679490 IP 10.75.22.32.31648 > 10.75.22.247.53: 4827+ A? kodi-machine. (27)
13:50:53.680068 IP 10.75.22.247.53 > 10.75.22.32.31648: 4827 NXDomain 0/1/0 (102)
```

### Your Environment
Used Operating system:
 - Mobile device: Huawei Honor 8
 - Android version: 8.0
 - Kodi version and platform: 18.4
 - Kore version: latest available

**Comment by tiagogaspar8** [comment]
Hi @brianjmurrell 

Can you test again?

I have a ipv6-only network and ipv6 lookups are working as expected.

**Comment by brianjmurrell** [comment]
Yeah, seems to be looking up AAAA records now.

**Comment by tiagogaspar8** [comment]
Can this be closed then?

**Comment by brianjmurrell** [comment]
I'm fine with that.
